{"$schema":"https://json-schema.org/draft/2020-12/schema","type":"object","additionalProperties":false,"required":["schema_version","order_id","hypothesis_id","outcome","evidence_tier","edge_claim","mode","provenance","metadata","artifacts","validation_seal","access_counters","contract_commit"],"properties":{"schema_version":{"const":"lily_l3_b714_date_only_preflight_report_v7"},"order_id":{"const":"B7.14R5"},"hypothesis_id":{"const":"L-3"},"outcome":{"enum":["synthetic_preflight_pass","scope_restricted"]},"evidence_tier":{"const":"E0"},"edge_claim":{"const":"none"},"mode":{"enum":["synthetic_preflight_pass","scope_restricted"]},"contract_commit":{"type":"string","minLength":1},"provenance":{"type":"object","additionalProperties":false,"required":["v3_checkpoint","v3_report_sha256","v3_addendum_sha256","historical_container_sha256","b73_original_ledger_row_sha256","missing_agent_trailer_commit"],"properties":{"v3_checkpoint":{"type":"string","pattern":"^[0-9a-f]{40}$"},"v3_report_sha256":{"type":"string","pattern":"^[0-9a-f]{64}$"},"v3_addendum_sha256":{"type":"string","pattern":"^[0-9a-f]{64}$"},"historical_container_sha256":{"type":"string","pattern":"^[0-9a-f]{64}$"},"b73_original_ledger_row_sha256":{"type":"string","pattern":"^[0-9a-f]{64}$"},"missing_agent_trailer_commit":{"type":"string","pattern":"^[0-9a-f]{40}$"}}},"metadata":{"type":"object","additionalProperties":false,"required":["path","sha256"],"properties":{"path":{"const":"tests/fixtures/l3_b714_v7/metadata.json"},"sha256":{"type":"string","pattern":"^[0-9a-f]{64}$"}}},"artifacts":{"type":"object","additionalProperties":false,"required":["scanner","runner","report_schema","attestation_schema","report_validator"],"properties":{"scanner":{"$ref":"#/$defs/identity"},"runner":{"$ref":"#/$defs/identity"},"report_schema":{"$ref":"#/$defs/identity"},"attestation_schema":{"$ref":"#/$defs/identity"},"report_validator":{"$ref":"#/$defs/identity"}}},"validation_seal":{"$ref":"#/$defs/seal"},"access_counters":{"$ref":"#/$defs/counters"},"attestation":{"$ref":"#/$defs/identity"},"blocker":{"type":"string"}},"$defs":{"identity":{"type":"object","additionalProperties":false,"required":["path","sha256"],"properties":{"path":{"type":"string","minLength":1},"sha256":{"type":"string","pattern":"^[0-9a-f]{64}$"}}},"seal":{"type":"object","additionalProperties":false,"required":["status","accessed"],"properties":{"status":{"const":"sealed_not_accessed"},"accessed":{"const":false}}},"counters":{"type":"object","additionalProperties":false,"required":["real_container_access_count","return_decode_count","research_decision_count","ledger_row_count","validation_access_count","new_schedule_attestation_count"],"properties":{"real_container_access_count":{"const":0},"return_decode_count":{"const":0},"research_decision_count":{"const":0},"ledger_row_count":{"const":0},"validation_access_count":{"const":0},"new_schedule_attestation_count":{"const":0}}}}}


