{"schema_version":"lily_l3_b714_date_only_preflight_report_v7","order_id":"B7.14R5","hypothesis_id":"L-3","outcome":"synthetic_preflight_pass","evidence_tier":"E0","edge_claim":"none","mode":"synthetic_preflight_pass","provenance":{"v3_checkpoint":"99e33857064e6eec76baba21ea64d9aaecea578f","v3_report_sha256":"71727c6ee76f2af5c862da1fdc59c9a717005065c3abc0d61830dc08dd1c41dc","v3_addendum_sha256":"c3ae1a58a6f00da691ef4edccf54dffb98c1415dd4613b0ac9f709286923a6fa","historical_container_sha256":"6608c0ef88f4b7edaef7523738d7a172215aa4f97c8c403adeba884d6582a4dd","b73_original_ledger_row_sha256":"594b8cbbdf7c27769191ab9495275803478481121372cd3bfc6f7e6d3a8a556a","missing_agent_trailer_commit":"512120f35461ecb99e607d20aa2937a056434339"},"metadata":{"path":"tests/fixtures/l3_b714_v7/metadata.json","sha256":"7ce22b6f73f4e2a9f3f97697bfb69dd74cf0bb444735b8a33ece63441a2627a5"},"artifacts":{"scanner":{"path":"lib/l3_b714_date_only_scanner_v7.py","sha256":"79f0628255aaad6ba7daa04841fcfc18aa5c13542057e4243515bdc490e0c521"},"runner":{"path":"scripts/run_l_3_b714_date_only_preflight_v7.py","sha256":"9d76efcda290ff54e477ce6deb65094165cb3e289300358fd5472a0f53cd7102"},"report_schema":{"path":"schemas/l_3_b714_date_only_preflight_report_v7.schema.json","sha256":"f1b5ca4779914e0d6e2f4cfb84f7c828256a11e66b0e07ee127754dcca36b6bb"},"attestation_schema":{"path":"schemas/l_3_b714_date_only_schedule_attestation_v7.schema.json","sha256":"293c6c2f8cb481a3e5f0a8f3f702a0485e326e65586c6b0a513fc45d5a483496"},"report_validator":{"path":"scripts/validate_l_3_b714_date_only_preflight_report_v7.py","sha256":"44bd5959c90c45228338c6dd327ad5b1a27e56be068e1a36e997f9a399583ad5"}},"validation_seal":{"status":"sealed_not_accessed","accessed":false},"access_counters":{"real_container_access_count":0,"return_decode_count":0,"research_decision_count":0,"ledger_row_count":0,"validation_access_count":0,"new_schedule_attestation_count":0},"contract_commit":"HEAD","attestation":{"path":"tests/fixtures/l3_b714_v7/attestation.json","sha256":"c871223489d5ea12bfa0c416b40573a8627eb5d77e2b5956269f586bde9c771f"}}
